{
  "baseAsset": "SUI",
  "contractSize": "1",
  "feeClassification": "UNKNOWN / VENUE ACCOUNT DEPENDENT",
  "instrumentSpecHash": "b754c7305132b08ac1215d2cfb244168e23917ef63efbbe17e6614e9e83f76ba",
  "makerFee": null,
  "marketType": "PERPETUAL",
  "metadataHash": "3f3436b34b80878f419e262c670367157d641d940b1b1af3736cefa0f9b7ffb7",
  "metadataSource": "Binance Futures exchangeInfo",
  "metadataTimestamp": "2026-09-27T20:17:08.117172Z",
  "minNotional": "5",
  "minQuantity": "0.1",
  "pricePrecision": 4,
  "priceScale": 10000,
  "quantityPrecision": 1,
  "quantityScale": 10,
  "quoteAsset": "USDT",
  "settlementAsset": "USDT",
  "stepSize": "0.1",
  "symbol": "SUIUSDT",
  "takerFee": null,
  "tickSize": "0.000100",
  "venue": "Binance USD-M Futures"
}
