{
  "baseAsset": "ZEC",
  "contractSize": "1",
  "feeClassification": "UNKNOWN / VENUE ACCOUNT DEPENDENT",
  "instrumentSpecHash": "68e4a417fad9e3352ab81c35908fb1ddc0c23c804ffe4236fa0fd9b3cb01800e",
  "makerFee": null,
  "marketType": "PERPETUAL",
  "metadataHash": "1ff3b6ee565e74f64f51c497afe0452bc415d0c4d72415b756e211e2dc258453",
  "metadataSource": "Binance Futures exchangeInfo",
  "metadataTimestamp": "2026-09-27T20:17:08.093454Z",
  "minNotional": "5",
  "minQuantity": "0.001",
  "pricePrecision": 2,
  "priceScale": 100,
  "quantityPrecision": 3,
  "quantityScale": 1000,
  "quoteAsset": "USDT",
  "settlementAsset": "USDT",
  "stepSize": "0.001",
  "symbol": "ZECUSDT",
  "takerFee": null,
  "tickSize": "0.01",
  "venue": "Binance USD-M Futures"
}
