{
  "baseAsset": "WLD",
  "contractSize": "1",
  "feeClassification": "UNKNOWN / VENUE ACCOUNT DEPENDENT",
  "instrumentSpecHash": "1fe990c7d2664d92bfa9aedd6827871b46996303e46034ccec767a06cc1e63fe",
  "makerFee": null,
  "marketType": "PERPETUAL",
  "metadataHash": "6bc4d086373937bebee7a037061a54bb5abdff9fc2e921d1b8be18ffdd294f69",
  "metadataSource": "Binance Futures exchangeInfo",
  "metadataTimestamp": "2026-09-27T20:17:08.140990Z",
  "minNotional": "5",
  "minQuantity": "1",
  "pricePrecision": 4,
  "priceScale": 10000,
  "quantityPrecision": 0,
  "quantityScale": 1,
  "quoteAsset": "USDT",
  "settlementAsset": "USDT",
  "stepSize": "1",
  "symbol": "WLDUSDT",
  "takerFee": null,
  "tickSize": "0.0001000",
  "venue": "Binance USD-M Futures"
}
